<?xml version="1.0" encoding="UTF-8"?>
<!DOCTYPE menu SYSTEM "menu.dtd">
<menu id="context">
	<itemlistmenu id="docctx">
		<label>[TITLE]</label>
		<icon src="[ICON]"></icon>
		<itemmenu id="title" type="text" target="_document">
			<label>[TITLE]</label>
			<icon src="[ICON]"/>
		</itemmenu>
		<itemmenu id="sep1" type="separator"/>
		<itemmenu id="view" target="_document">
			<label>[TEXT:eui:View Document]</label>
			<script file="lib/ui/fdl-interface-action-common.js" class="Fdl.InterfaceAction.ViewDocument"/>
		</itemmenu>
		<itemmenu id="edit" target="_document" visibility="hidden">
			<label>[TEXT:eui:Edit document]</label>
			<control method="!canEdit()" visibility="visible"/>
			<script file="lib/ui/fdl-interface-action-common.js" class="Fdl.InterfaceAction.EditDocument"/>
		</itemmenu>
		<itemmenu id="delete" target="_self" visibility="hidden" useselection="yes">			
			<label>[TEXT:eui:Delete]</label>
			<control privilege="delete" visibility="visible"/>
			<script file="lib/ui/fdl-interface-action-common.js" class="Fdl.InterfaceAction.Delete"/>
			<confirm>
				<label>[TEXT:eui:Sure delete ?]</label>
				<continue>[TEXT:eui:Delete]</continue> 
				<cancel>[TEXT:eui:Cancel deletion]</cancel> 
			</confirm>
		</itemmenu>   
		<itemmenu id="remove" target="_self" visibility="hidden" useselection="yes">
			<label>[TEXT:eui:Remove from folder]</label>
			<control object="folder" privilege="modify" visibility="visible"/>
			<script file="lib/ui/fdl-interface-action-common.js" class="Fdl.InterfaceAction.RemoveFromFolder"/>
			<confirm>
				<label>[TEXT:eui:Sure remove from folder ?]</label>
				<continue>[TEXT:eui:Remove from folder]</continue> 
				<cancel>[TEXT:eui:Cancel remove]</cancel> 
			</confirm>
		</itemmenu>     
		<itemmenu id="copy" target="_self" visibility="hidden">
			<label>[TEXT:eui:Duplicate document]</label>
			<control object="folder" privilege="modify" visibility="visible"/>
			<script file="lib/ui/fdl-interface-action-common.js" class="Fdl.InterfaceAction.Duplicate"/>
		</itemmenu>    
		<itemmenu id="lock" target="_self" visibility="hidden" useselection="yes">
			<label>[TEXT:eui:Lock]</label>
			<control method="canLock()" visibility="visible"/>
			<control method="isLocked()" visibility="hidden"/>
			<!--<icon src="lock.png"/>-->
			<script file="lib/ui/fdl-interface-action-common.js" class="Fdl.InterfaceAction.Lock"/>
		</itemmenu>  
		<itemmenu id="unlock" target="_self" useselection="yes">
			<label>[TEXT:eui:Unlock]</label>
			<control method="!isLocked()" visibility="hidden"/>
			<control method="!canUnLock()" visibility="hidden"/>
			<script file="lib/ui/fdl-interface-action-common.js" class="Fdl.InterfaceAction.Unlock"/>
		</itemmenu>
		<itemmenu id="mail" target="_self" visibility="hidden">
			<label>[TEXT:eui:Send Mail]</label>
			<control privilege="send" visibility="visible"/>
			<!--<script file="lib/ui/fdl-interface-action-common.js" class="Fdl.InterfaceAction.SendMail"/>-->
			<url href="?app=FDL&amp;action=EDITMAIL&amp;mid=%ID%&amp;viewdoc=N"/>
		</itemmenu>
		<itemmenu id="printview" target="_hidden" visibility="visible">
			<label>[TEXT:eui:View print version]</label>
			
			<!--<script file="lib/ui/fdl-interface-action-common.js" class="Fdl.InterfaceAction.SendMail"/>-->
			<url  href="javascript:window.open('?app=FDL&amp;action=IMPCARD&amp;view=print&amp;id=%ID%','_blank')" />
		</itemmenu>
		<itemmenu id="rsslink" target="_self" visibility="hidden">
			<label>[TEXT:eui:Rss Link]</label>
			<control method="equal('defDoctype','D')" visibility="visible"/>
			<!--<url href="?app=FREEDOM&amp;action=FREEDOM_RSS&amp;authtype=open&amp;id=%ID%"/>-->
			<url method="::getRssLink()"/>
		</itemmenu>
		<itemmenu id="sep2" type="separator"/>
		<itemmenu id="histo" target="_history">
			<label>[TEXT:eui:Historic]</label>
			<script file="lib/ui/fdl-interface-action-common.js" class="Fdl.InterfaceAction.Historic"/>
		</itemmenu>
		
                <itemmenu id="properties">
                        <label>[TEXT:eui:View Properties]</label>
                        <url href="?app=FDL&amp;action=IMPCARD&amp;zone=FDL:VIEWPROPERTIES:T&amp;id=%ID%"/>
                </itemmenu>
	</itemlistmenu>
	
</menu>
