<?xml version="1.0" encoding="UTF-8"?>
<!DOCTYPE menu SYSTEM "menu.dtd">
<menu id="context">
	<itemlistmenu id="docctx">
		<!--<label>[TEXT:eui:Document Selection]</label>-->
		<itemmenu id="delete" target="_self">
			<label>[TEXT:eui:Delete]</label>
			<script file="lib/ui/fdl-interface-action-common.js" class="Fdl.InterfaceAction.Delete"/>
			<confirm>
				<label>[TEXT:eui:Sure delete ?]</label>
				<continue>[TEXT:eui:Delete]</continue> 
				<cancel>[TEXT:eui:Cancel deletion]</cancel> 
			</confirm>
		</itemmenu>   
		<itemmenu id="remove" target="_self" visibility="hidden">
                        <label>[TEXT:eui:Remove from folder]</label>
			<control object="folder" privilege="modify" visibility="visible"/>
			<script file="lib/ui/fdl-interface-action-common.js" class="Fdl.InterfaceAction.RemoveFromFolder"/>
			<confirm>
				<label>[TEXT:eui:Sure remove from folder ?]</label>
				<continue>[TEXT:eui:Remove from folder]</continue> 
				<cancel>[TEXT:eui:Cancel remove]</cancel> 
			</confirm>
		</itemmenu>
		<itemmenu id="lock" target="_self">
			<label>[TEXT:eui:Lock]</label>
			<!--<icon src="lock.png"/>-->
			<script file="lib/ui/fdl-interface-action-common.js" class="Fdl.InterfaceAction.Lock"/>
		</itemmenu>  
		<itemmenu id="unlock" target="_self">
			<label>[TEXT:eui:Unlock]</label>
			<script file="lib/ui/fdl-interface-action-common.js" class="Fdl.InterfaceAction.Unlock"/>
		</itemmenu>		
	</itemlistmenu>
</menu>